{
  "schema_version":1,"case_id":"kv260_linux_gpio_mailbox","revision":1,"status":"READY","owner":"amd_soc_hardware_validator","standard_profile":"portable-vio-ila-v1",
  "target":{"part":"xck26-sfvc784-2LV-c","board_part":"xilinx.com:kv260_som:part0:1.4"},"required_capabilities":["jtag","vivado_hw_manager","ila","vio","jtag_axi"],
  "programming":{"accepted_backends":["vivado_hw_manager","linux_fpga_manager"],"require_matching_ltx":true,"requires_xsa":true},
  "stimulus":{"adapter":"jtag_axi","control_plane":"jtag_axi","data_plane":"jtag_axi","seed":48,"description":"Exercise deterministic mailbox commands over JTAG AXI; Linux GPIO drivers and external pins are platform concerns outside the public-kernel oracle."},
  "instrumentation":{"vio_cores":[{"id":"VIO-HW-TEST-0","clock_domain":"clk","controls":[{"name":"hw_test_reset","width":1,"source":"hardware test shell","purpose":"Hold the test shell in reset.","safe_initial_value":"0x1"},{"name":"hw_test_start","width":1,"source":"hardware test shell","purpose":"Start one deterministic self-test.","safe_initial_value":"0x0"},{"name":"hw_test_enable","width":1,"source":"hardware test shell","purpose":"Enable stimulus generation.","safe_initial_value":"0x0"}],"status":[{"name":"hw_test_busy","width":1,"source":"hardware test shell","purpose":"Report an active test."},{"name":"hw_test_done","width":1,"source":"hardware test shell","purpose":"Report bounded completion."},{"name":"hw_test_pass","width":1,"source":"hardware test shell","purpose":"Report aggregate pass status."},{"name":"hw_test_error_code","width":16,"source":"hardware test shell","purpose":"Identify the first failure."}]}],
    "ila_cores":[{"id":"ILA-HW-TEST-0","clock_domain":"clk","kind":"system_ila","depth":1024,"probes":[{"name":"hw_test_start","width":1,"source":"hardware test shell","purpose":"Trigger on accepted test start.","role":"trigger"},{"name":"hw_test_activity","width":1,"source":"kv260_linux_gpio_mailbox","purpose":"Observe accepted mailbox commands.","role":"data"},{"name":"hw_test_done","width":1,"source":"hardware test shell","purpose":"Correlate bounded completion.","role":"status"},{"name":"hw_test_pass","width":1,"source":"hardware test shell","purpose":"Capture final self-check status.","role":"status"}],"trigger":{"probe":"hw_test_start","condition":"eq1'bR","position":128}}],"debug_map_required":true},
  "test_sequence":[{"id":"HW-ACT-PRECHECK","action":"precheck_target","timeout_seconds":30,"description":"Verify target identity and artifacts."},{"id":"HW-ACT-QUIESCE","action":"quiesce","timeout_seconds":30,"description":"Quiesce programmable-logic access."},{"id":"HW-ACT-PROGRAM","action":"program","timeout_seconds":120,"description":"Program the authorized image."},{"id":"HW-ACT-REFRESH","action":"refresh_debug","timeout_seconds":30,"description":"Refresh matching debug cores."},{"id":"HW-ACT-RESET","action":"reset_vio","timeout_seconds":10,"description":"Drive VIO controls to safe values."},{"id":"HW-ACT-IMMEDIATE","action":"capture_immediate","timeout_seconds":60,"description":"Capture an immediate connectivity trace."},{"id":"HW-ACT-CONFIGURE","action":"configure_stimulus","timeout_seconds":30,"description":"Configure deterministic seeded stimulus."},{"id":"HW-ACT-ARM","action":"arm_ila","timeout_seconds":30,"description":"Arm the functional ILA."},{"id":"HW-ACT-START","action":"start","timeout_seconds":10,"description":"Pulse the VIO start control."},{"id":"HW-ACT-WAIT","action":"wait_done","timeout_seconds":120,"description":"Wait for bounded completion."},{"id":"HW-ACT-STATUS","action":"read_status","timeout_seconds":30,"description":"Read final VIO status."},{"id":"HW-ACT-UPLOAD","action":"upload_ila","timeout_seconds":60,"description":"Upload the functional capture."},{"id":"HW-ACT-EVALUATE","action":"evaluate","timeout_seconds":30,"description":"Evaluate mandatory criteria."},{"id":"HW-ACT-CLEANUP","action":"cleanup","timeout_seconds":30,"description":"Restore safe state."}],
  "pass_criteria":[{"id":"HW-CRIT-TARGET","mandatory":true,"measurement":"target.part_matches","operator":"equals","expected":true},{"id":"HW-CRIT-DEBUG","mandatory":true,"measurement":"debug.required_cores_present","operator":"equals","expected":true},{"id":"HW-CRIT-IMMEDIATE","mandatory":true,"measurement":"ila.immediate_capture_samples","operator":"greater_or_equal","expected":1},{"id":"HW-CRIT-DONE","mandatory":true,"measurement":"vio.hw_test_done","operator":"equals","expected":1},{"id":"HW-CRIT-PASS","mandatory":true,"measurement":"vio.hw_test_pass","operator":"equals","expected":1},{"id":"HW-CRIT-ERROR","mandatory":true,"measurement":"vio.hw_test_error_code","operator":"equals","expected":0},{"id":"HW-CRIT-CAPTURE","mandatory":true,"measurement":"ila.functional_capture","operator":"exists","expected":true}],
  "cleanup":{"required":true,"actions":["reset_vio_outputs","stop_test_software","restore_safe_state"]},"external_equipment":[]
}
